{"$defs":{"asset":{"additionalProperties":false,"properties":{"bytes":{"minimum":1,"type":"integer"},"mode":{"const":"100644"},"object_type":{"const":"blob"},"oid":{"pattern":"^[0-9a-f]{40}$","type":"string"},"sha256":{"$ref":"#/$defs/sha256"},"source_path":{"$ref":"#/$defs/relative_path"},"target_path":{"pattern":"^benchmark/es_f1/[A-Za-z0-9._-]+$","type":"string"}},"required":["bytes","mode","object_type","oid","sha256","source_path","target_path"],"type":"object"},"author":{"additionalProperties":false,"properties":{"email":{"const":"e-series-source-projection@invalid"},"name":{"const":"E-series source projection"},"timestamp":{"const":1784674813},"timezone":{"const":"-0700"}},"required":["name","email","timestamp","timezone"],"type":"object"},"relative_path":{"minLength":1,"pattern":"^(?!/)(?!\\.{1,2}(?:/|$))(?!.*\\/\\.{1,2}(?:/|$))(?!.*//)(?!.*\\\\)[A-Za-z0-9._-]+(?:/[A-Za-z0-9._-]+)*$","type":"string"},"sha1":{"pattern":"^[0-9a-f]{40}$","type":"string"},"sha256":{"pattern":"^sha256:[0-9a-f]{64}$","type":"string"}},"$schema":"https://json-schema.org/draft/2020-12/schema","additionalProperties":false,"properties":{"actual_e1":{"additionalProperties":false,"properties":{"materializer_version":{"const":"git-detached-clone-v1"},"post_setup_tree_manifest_sha256":{"const":"sha256:23014cf7db797284214503736f52f2fb8a35da7113c0f37c5a6277bcb9afa13a"},"resolved_commit":{"$ref":"#/$defs/sha1"},"source_tree_manifest_sha256":{"const":"sha256:23014cf7db797284214503736f52f2fb8a35da7113c0f37c5a6277bcb9afa13a"},"status":{"const":"passed"},"verified_git_tree":{"pattern":"^git-tree:[0-9a-f]{40}$","type":"string"}},"required":["status","materializer_version","resolved_commit","verified_git_tree","source_tree_manifest_sha256","post_setup_tree_manifest_sha256"],"type":"object"},"parent_projection":{"additionalProperties":false,"properties":{"commit":{"const":"8f191031f233d50a4d020d8a988036e99487f570"},"manifest_path":{"const":"experiments/orc_effectiveness/f1_es/projection-manifest.json"},"manifest_sha256":{"const":"sha256:f35631ebb324cee87e9105b0504dc7b5e2663f540d914612cac2f85b1a86dfc1"},"repository_locator":{"const":"/home/ollie/.local/state/orchestrator/es-source-projections/git-sha1/8f191031f233d50a4d020d8a988036e99487f570"},"repository_snapshot_sha256":{"const":"sha256:5c17e0ce00c67ab95b1553b76b556d412ceff3b07faba4c21b15018fcf240d38"},"tree":{"const":"e64f3c05f5a0894f41c047d128a9040a2cda6764"}},"required":["manifest_path","manifest_sha256","commit","tree","repository_locator","repository_snapshot_sha256"],"type":"object"},"policies":{"additionalProperties":false,"properties":{"asset_overlay":{"const":"add-only-under-benchmark-es-f1.v1"},"history":{"const":"exact-parent-and-child.v1"},"object_closure":{"const":"reachable-only.v1"},"source_projection_mutation":{"const":"forbidden.v1"}},"required":["asset_overlay","history","object_closure","source_projection_mutation"],"type":"object"},"recipe":{"additionalProperties":false,"properties":{"author":{"$ref":"#/$defs/author"},"commit":{"$ref":"#/$defs/sha1"},"commit_content_bytes":{"minimum":1,"type":"integer"},"commit_content_sha256":{"$ref":"#/$defs/sha256"},"message":{"minLength":1,"type":"string"},"message_bytes":{"minimum":1,"type":"integer"},"message_sha256":{"$ref":"#/$defs/sha256"},"policy":{"const":"es-f1-task-seed.v3"},"tree":{"$ref":"#/$defs/sha1"}},"required":["policy","author","message","message_bytes","message_sha256","tree","commit_content_bytes","commit_content_sha256","commit"],"type":"object"},"repository":{"additionalProperties":false,"properties":{"commit_count":{"const":2},"head_ref":{"const":"refs/heads/task-seed"},"locator":{"pattern":"^/","type":"string"},"object_count":{"minimum":1,"type":"integer"},"object_format":{"const":"sha1"},"relative_path":{"pattern":"^git-sha1/[0-9a-f]{40}$","type":"string"},"repository_snapshot_sha256":{"$ref":"#/$defs/sha256"},"storage_root":{"const":"/home/ollie/.local/state/orchestrator/es-task-seeds"},"unreachable_object_count":{"const":0}},"required":["storage_root","relative_path","locator","object_format","head_ref","commit_count","object_count","unreachable_object_count","repository_snapshot_sha256"],"type":"object"},"schema_version":{"const":"es_f1_task_seed.v3"},"visible_assets":{"additionalProperties":false,"properties":{"row_count":{"const":8},"rows":{"items":{"$ref":"#/$defs/asset"},"maxItems":8,"minItems":8,"type":"array"},"serialization":{"const":"canonical-json-lf.v1"},"sha256":{"$ref":"#/$defs/sha256"}},"required":["serialization","sha256","row_count","rows"],"type":"object"}},"required":["schema_version","parent_projection","visible_assets","recipe","repository","actual_e1","policies"],"title":"ES F1 deterministic task seed","type":"object"}
