{"actual_e1":{"materializer_version":"git-detached-clone-v1","post_setup_tree_manifest_sha256":"sha256:23014cf7db797284214503736f52f2fb8a35da7113c0f37c5a6277bcb9afa13a","resolved_commit":"d1c07c504dad9254176e84206bb2fbaa1a0410e4","source_tree_manifest_sha256":"sha256:23014cf7db797284214503736f52f2fb8a35da7113c0f37c5a6277bcb9afa13a","status":"passed","verified_git_tree":"git-tree:9e13df2883ba47f2e325845176fbcf0e6c497e0b"},"parent_projection":{"commit":"8f191031f233d50a4d020d8a988036e99487f570","manifest_path":"experiments/orc_effectiveness/f1_es/projection-manifest.json","manifest_sha256":"sha256:f35631ebb324cee87e9105b0504dc7b5e2663f540d914612cac2f85b1a86dfc1","repository_locator":"/home/ollie/.local/state/orchestrator/es-source-projections/git-sha1/8f191031f233d50a4d020d8a988036e99487f570","repository_snapshot_sha256":"sha256:5c17e0ce00c67ab95b1553b76b556d412ceff3b07faba4c21b15018fcf240d38","tree":"e64f3c05f5a0894f41c047d128a9040a2cda6764"},"policies":{"asset_overlay":"add-only-under-benchmark-es-f1.v1","history":"exact-parent-and-child.v1","object_closure":"reachable-only.v1","source_projection_mutation":"forbidden.v1"},"recipe":{"author":{"email":"e-series-source-projection@invalid","name":"E-series source projection","timestamp":1784674813,"timezone":"-0700"},"commit":"d1c07c504dad9254176e84206bb2fbaa1a0410e4","commit_content_bytes":496,"commit_content_sha256":"sha256:9a2f480cf40d7d2762d9ac361e967be4b2b8a1e4de94003f2a8e2b299d2fa31c","message":"E-series F1 deterministic task seed\n\nProjection-Commit: 8f191031f233d50a4d020d8a988036e99487f570\nVisible-Assets-SHA256: bc64a45e6e2ebfd1e35e9cfe1898e551ab352d7ba201214a4c25e4f88c410c86\nTask-Seed-Policy: es-f1-task-seed.v3\n","message_bytes":222,"message_sha256":"sha256:a7d5ae89e357990a5b7d240ed888c50aa1cf9531848e26e43991d63944df2f8a","policy":"es-f1-task-seed.v3","tree":"9e13df2883ba47f2e325845176fbcf0e6c497e0b"},"repository":{"commit_count":2,"head_ref":"refs/heads/task-seed","locator":"/home/ollie/.local/state/orchestrator/es-task-seeds/git-sha1/d1c07c504dad9254176e84206bb2fbaa1a0410e4","object_count":2216,"object_format":"sha1","relative_path":"git-sha1/d1c07c504dad9254176e84206bb2fbaa1a0410e4","repository_snapshot_sha256":"sha256:ec2ea2e0ed5399af4102de2d494041d6032b864a253308101b8bcf212ad5f908","storage_root":"/home/ollie/.local/state/orchestrator/es-task-seeds","unreachable_object_count":0},"schema_version":"es_f1_task_seed.v3","visible_assets":{"row_count":8,"rows":[{"bytes":2352,"mode":"100644","object_type":"blob","oid":"bd5c264d1c9099de01738130ee0cdafe649fa9a2","sha256":"sha256:613be42c053ee664efdfa5aa65cc62c5ccde0e7c6a84d676c53a8ed20ac9f3cd","source_path":"experiments/orc_effectiveness/f1_es/task/candidate-config-evidence.schema.json","target_path":"benchmark/es_f1/candidate-config-evidence.schema.json"},{"bytes":1438,"mode":"100644","object_type":"blob","oid":"d764e6dff9fbcf351ceea0fc35c2ea81eed6708b","sha256":"sha256:d690e68e8498b6a7c9b36511ed3df39cb88bfdbedcc4f05d22a22783c1f80008","source_path":"experiments/orc_effectiveness/f1_es/task/config-resolution-probe-request.schema.json","target_path":"benchmark/es_f1/config-resolution-probe-request.schema.json"},{"bytes":909,"mode":"100644","object_type":"blob","oid":"67c215101b9dced2a08c8dc1bd9146d1f41509ba","sha256":"sha256:b4d6330c2c1600a3d00c8bc96c89f3629acf4491d52ba2d5f9bd48f242d8632e","source_path":"experiments/orc_effectiveness/f1_es/task/config-resolution-probe-result.schema.json","target_path":"benchmark/es_f1/config-resolution-probe-result.schema.json"},{"bytes":3049,"mode":"100644","object_type":"blob","oid":"cce260c03008129026852a5f1458a4f3e3237362","sha256":"sha256:20686b69f4a995b29dc9da4d76913bbcc6de17181cf835f3e5ef697e5cca6106","source_path":"experiments/orc_effectiveness/f1_es/task/neutral-task-brief.md","target_path":"benchmark/es_f1/neutral-task-brief.md"},{"bytes":1738,"mode":"100644","object_type":"blob","oid":"e4a60d090baaeeaaecb8ba938b5097908d8a19e8","sha256":"sha256:412ad6e30741d3ceec5297cc11e4291c4313fac93726c8a7a5c69f2499e894a1","source_path":"experiments/orc_effectiveness/f1_es/task/visible-check-manifest.json","target_path":"benchmark/es_f1/visible-check-manifest.json"},{"bytes":2291,"mode":"100644","object_type":"blob","oid":"5dbd7062d420e941c1a74453c6f521b5592ed00a","sha256":"sha256:0b310041b4def7a22682b5cbb99b3049a5faf1b2188f74ab3bbb9ec6d4972fd5","source_path":"experiments/orc_effectiveness/f1_es/task/visible-check-manifest.schema.json","target_path":"benchmark/es_f1/visible-check-manifest.schema.json"},{"bytes":6985,"mode":"100644","object_type":"blob","oid":"7d913becc1ef4849ef8dda7b463f21c70cfe6a2c","sha256":"sha256:46bc6e79823dd0d7bd50963d09c8fc55d8b69adf1a6ca48ff3e06f2613280b91","source_path":"experiments/orc_effectiveness/f1_es/task/visible-task-contract.json","target_path":"benchmark/es_f1/visible-task-contract.json"},{"bytes":6004,"mode":"100644","object_type":"blob","oid":"a7defebaa63c51674c9fc09441971707ddc74879","sha256":"sha256:60acc4bdaf9f8b36d75a0b4cbabe49da3b3a2cbb26b76163821635ccd5e33e35","source_path":"experiments/orc_effectiveness/f1_es/task/visible-task-contract.schema.json","target_path":"benchmark/es_f1/visible-task-contract.schema.json"}],"serialization":"canonical-json-lf.v1","sha256":"sha256:bc64a45e6e2ebfd1e35e9cfe1898e551ab352d7ba201214a4c25e4f88c410c86"}}
